{
  "$schema": "https://json-schema.org/draft/2020-12/schema",
  "$id": "https://aestheticfunction.github.io/dspack-emit/schema/profile.v2.schema.json",
  "title": "dspack-emit a2ui Profile v2",
  "description": "JSON form of the a2ui target's mapping Profile, second language. A v2 plan authors the internal transformation model directly \u2014 Identity / Route / Collect in a closed string syntax \u2014 instead of the v1 surface-plan directives. One profile language per document: this schema refuses `surfacePlan` and `subCoverage`; profile.v1.schema.json refuses `surface` and `functions`. loadProfile() dispatches on `profileVersion` and validates against exactly one of the two.",
  "type": "object",
  "additionalProperties": false,
  "patternProperties": {
    "^x-": {}
  },
  "required": [
    "profileVersion",
    "catalogTitle",
    "catalogDescription",
    "catalogIdBase",
    "instructions",
    "primaryColorToken",
    "components",
    "synthesized",
    "casualtyComponents",
    "surfaceSynthesis"
  ],
  "properties": {
    "profileVersion": {
      "const": "2"
    },
    "catalogTitle": {
      "type": "string",
      "minLength": 1
    },
    "catalogDescription": {
      "type": "string",
      "minLength": 1
    },
    "catalogIdBase": {
      "type": "string",
      "format": "uri",
      "pattern": "^https://"
    },
    "instructions": {
      "type": "string"
    },
    "primaryColorToken": {
      "type": "object",
      "additionalProperties": false,
      "required": [
        "category",
        "name"
      ],
      "properties": {
        "category": {
          "type": "string",
          "minLength": 1
        },
        "name": {
          "type": "string",
          "minLength": 1
        }
      }
    },
    "components": {
      "type": "array",
      "items": {
        "$ref": "#/$defs/componentPlan"
      }
    },
    "synthesized": {
      "type": "array",
      "items": {
        "$ref": "#/$defs/componentPlan"
      }
    },
    "casualtyComponents": {
      "type": "array",
      "items": {
        "type": "object",
        "additionalProperties": false,
        "patternProperties": {
          "^x-": {}
        },
        "required": [
          "dspackId",
          "attempted",
          "class",
          "reason"
        ],
        "properties": {
          "dspackId": {
            "$ref": "#/$defs/dspackId"
          },
          "attempted": {
            "type": "string",
            "minLength": 1
          },
          "class": {
            "enum": [
              "maps-cleanly",
              "synthesis-defaults",
              "lossy",
              "cannot-represent"
            ]
          },
          "reason": {
            "type": "string",
            "minLength": 1
          }
        }
      }
    },
    "intentionallyOmitted": {
      "type": "array",
      "items": {
        "$ref": "#/$defs/dspackId"
      }
    },
    "surfaceSynthesis": {
      "type": "object",
      "additionalProperties": false,
      "required": [
        "textComponent",
        "textProp",
        "wrapComponent",
        "wrapChildrenProp"
      ],
      "properties": {
        "textComponent": {
          "$ref": "#/$defs/a2uiName"
        },
        "textProp": {
          "type": "string",
          "minLength": 1
        },
        "wrapComponent": {
          "$ref": "#/$defs/a2uiName"
        },
        "wrapChildrenProp": {
          "type": "string",
          "minLength": 1
        }
      }
    },
    "functions": {
      "type": "object",
      "description": "A2UI catalog functions this profile declares, keyed by call name. Emitted into the catalog's functions section and enforced on every FunctionCall: an instance calling an undeclared function fails gate A3. Definitions are declarative schemas for the call's args \u2014 never executable code.",
      "propertyNames": {
        "pattern": "^[a-z][A-Za-z0-9]*$"
      },
      "additionalProperties": {
        "type": "object",
        "additionalProperties": false,
        "required": [
          "description",
          "returns"
        ],
        "properties": {
          "description": {
            "type": "string",
            "minLength": 1
          },
          "returns": {
            "enum": [
              "string",
              "number",
              "boolean",
              "array",
              "object"
            ]
          },
          "args": {
            "type": "object",
            "description": "JSON Schema (object form) validating the call's args object; omit for arg-less functions."
          }
        }
      }
    }
  },
  "$defs": {
    "dspackId": {
      "type": "string",
      "pattern": "^[a-z][a-z0-9-]*$"
    },
    "a2uiName": {
      "type": "string",
      "pattern": "^[A-Z][A-Za-z0-9]*$"
    },
    "componentPlan": {
      "type": "object",
      "additionalProperties": false,
      "patternProperties": {
        "^x-": {}
      },
      "required": [
        "a2ui",
        "commons",
        "structural",
        "required"
      ],
      "properties": {
        "a2ui": {
          "$ref": "#/$defs/a2uiName"
        },
        "dspackId": {
          "$ref": "#/$defs/dspackId"
        },
        "description": {
          "type": "string"
        },
        "commons": {
          "type": "array",
          "items": {
            "type": "string",
            "minLength": 1
          }
        },
        "structural": {
          "type": "object",
          "additionalProperties": {
            "type": "object",
            "additionalProperties": false,
            "required": [
              "schema",
              "description",
              "synthNote"
            ],
            "properties": {
              "schema": {},
              "description": {
                "type": "string",
                "minLength": 1
              },
              "synthNote": {
                "type": "string",
                "minLength": 1
              }
            }
          }
        },
        "propMap": {
          "type": "object",
          "additionalProperties": {
            "type": "object",
            "additionalProperties": false,
            "required": [
              "a2ui",
              "kind"
            ],
            "properties": {
              "a2ui": {
                "type": "string",
                "minLength": 1
              },
              "kind": {
                "enum": [
                  "enum",
                  "string",
                  "boolean",
                  "number"
                ]
              },
              "targetEnum": {
                "type": "array",
                "items": {
                  "type": "string"
                },
                "minItems": 1
              },
              "valueMap": {
                "type": "object",
                "additionalProperties": {
                  "type": "string"
                }
              },
              "default": {
                "type": "string"
              },
              "description": {
                "type": "string"
              }
            }
          }
        },
        "required": {
          "type": "array",
          "items": {
            "type": "string"
          }
        },
        "surface": {
          "type": "object",
          "additionalProperties": false,
          "patternProperties": {
            "^x-": {}
          },
          "properties": {
            "transparent": {
              "oneOf": [
                {
                  "const": true
                },
                {
                  "type": "object",
                  "additionalProperties": false,
                  "required": [
                    "donate"
                  ],
                  "properties": {
                    "donate": {
                      "type": "array",
                      "minItems": 1,
                      "items": {
                        "type": "object",
                        "additionalProperties": false,
                        "required": [
                          "from",
                          "to"
                        ],
                        "properties": {
                          "from": {
                            "type": "string",
                            "pattern": "^(self\\.text|sub\\([a-z][a-z0-9-]*(\\|[a-z][a-z0-9-]*)*\\)\\.text)$"
                          },
                          "to": {
                            "type": "string",
                            "pattern": "^prop:[A-Za-z][A-Za-z0-9]*$"
                          }
                        }
                      }
                    }
                  }
                }
              ]
            },
            "routes": {
              "type": "array",
              "items": {
                "type": "object",
                "additionalProperties": false,
                "required": [
                  "from",
                  "to"
                ],
                "properties": {
                  "from": {
                    "type": "array",
                    "minItems": 1,
                    "description": "Ordered fallback chain; the first selector that yields a value wins.",
                    "items": {
                      "type": "string",
                      "pattern": "^(self\\.text|self\\.props\\.[A-Za-z][A-Za-z0-9]*|sub\\([a-z][a-z0-9-]*(\\|[a-z][a-z0-9-]*)*\\)\\.(text|label|firstText|subtreeText)|children|synthesized\\.action)$"
                    }
                  },
                  "to": {
                    "type": "string",
                    "pattern": "^(prop|textChild|slot|slots|action):[A-Za-z][A-Za-z0-9]*$"
                  },
                  "overwrite": {
                    "type": "boolean"
                  }
                }
              }
            },
            "collects": {
              "type": "array",
              "items": {
                "oneOf": [
                  {
                    "type": "object",
                    "additionalProperties": false,
                    "required": [
                      "of",
                      "into",
                      "item"
                    ],
                    "properties": {
                      "of": {
                        "type": "array",
                        "minItems": 1,
                        "items": {
                          "type": "string",
                          "pattern": "^[a-z][a-z0-9-]*$"
                        }
                      },
                      "into": {
                        "type": "string",
                        "pattern": "^prop:[A-Za-z][A-Za-z0-9]*$"
                      },
                      "item": {
                        "type": "object",
                        "minProperties": 1,
                        "propertyNames": {
                          "pattern": "^[A-Za-z][A-Za-z0-9]*$"
                        },
                        "additionalProperties": {
                          "type": "string",
                          "pattern": "^(self\\.text|self\\.id|self\\.props\\.[A-Za-z][A-Za-z0-9]*)$"
                        },
                        "description": "T2 item-mode: one record per matching descendant; fields resolve on the item's own node (self.text, self.props.<prop>, self.id). Joins and sibling reads are T3."
                      },
                      "join": {
                        "type": "object",
                        "additionalProperties": false,
                        "required": [
                          "with",
                          "on",
                          "fields"
                        ],
                        "properties": {
                          "with": {
                            "type": "array",
                            "minItems": 1,
                            "items": {
                              "type": "string",
                              "pattern": "^[a-z][a-z0-9-]*$"
                            }
                          },
                          "on": {
                            "type": "object",
                            "additionalProperties": false,
                            "required": [
                              "left",
                              "right"
                            ],
                            "properties": {
                              "left": {
                                "type": "string",
                                "pattern": "^(self\\.text|self\\.id|self\\.props\\.[A-Za-z][A-Za-z0-9]*)$"
                              },
                              "right": {
                                "type": "string",
                                "pattern": "^(self\\.text|self\\.id|self\\.props\\.[A-Za-z][A-Za-z0-9]*)$"
                              }
                            }
                          },
                          "fields": {
                            "type": "object",
                            "minProperties": 1,
                            "propertyNames": {
                              "pattern": "^[A-Za-z][A-Za-z0-9]*$"
                            },
                            "additionalProperties": {
                              "type": "string",
                              "pattern": "^(children|self\\.text|self\\.id|self\\.props\\.[A-Za-z][A-Za-z0-9]*)$"
                            },
                            "description": "Record fields sourced from the JOINED side \u2014 item-local selectors, or the literal \"children\" for the slot-valued field (the counterpart's children emit as instances; the record carries the reference)."
                          },
                          "optional": {
                            "type": "boolean",
                            "description": "0..1 counterparts allowed when true; exactly one required otherwise."
                          }
                        },
                        "description": "T3 declared key join onto a sibling sub-family. The profile names the relation; the emitter never infers one \u2014 no positional pairing, no nearest-sibling, no similarity."
                      }
                    }
                  },
                  {
                    "type": "object",
                    "additionalProperties": false,
                    "required": [
                      "of",
                      "into",
                      "shape",
                      "row",
                      "cells"
                    ],
                    "properties": {
                      "of": {
                        "type": "array",
                        "minItems": 1,
                        "items": {
                          "type": "string",
                          "pattern": "^[a-z][a-z0-9-]*$"
                        }
                      },
                      "into": {
                        "type": "string",
                        "pattern": "^prop:[A-Za-z][A-Za-z0-9]*$"
                      },
                      "shape": {
                        "enum": [
                          "flat",
                          "records"
                        ]
                      },
                      "field": {
                        "type": "string",
                        "pattern": "^[A-Za-z][A-Za-z0-9]*$"
                      },
                      "row": {
                        "type": "array",
                        "minItems": 1,
                        "items": {
                          "type": "string",
                          "pattern": "^[a-z][a-z0-9-]*$"
                        }
                      },
                      "cells": {
                        "type": "array",
                        "minItems": 1,
                        "items": {
                          "type": "string",
                          "pattern": "^[a-z][a-z0-9-]*$"
                        }
                      }
                    }
                  }
                ]
              }
            },
            "subs": {
              "type": "object",
              "propertyNames": {
                "pattern": "^[a-z][a-z0-9-]*$"
              },
              "additionalProperties": {
                "oneOf": [
                  {
                    "const": "transparent"
                  },
                  {
                    "type": "object",
                    "additionalProperties": false,
                    "required": [
                      "transparent"
                    ],
                    "properties": {
                      "transparent": {
                        "oneOf": [
                          {
                            "const": true
                          },
                          {
                            "type": "object",
                            "additionalProperties": false,
                            "required": [
                              "donate"
                            ],
                            "properties": {
                              "donate": {
                                "type": "array",
                                "minItems": 1,
                                "items": {
                                  "type": "object",
                                  "additionalProperties": false,
                                  "required": [
                                    "from",
                                    "to"
                                  ],
                                  "properties": {
                                    "from": {
                                      "type": "string",
                                      "pattern": "^(self\\.text|sub\\([a-z][a-z0-9-]*(\\|[a-z][a-z0-9-]*)*\\)\\.text)$"
                                    },
                                    "to": {
                                      "type": "string",
                                      "pattern": "^prop:[A-Za-z][A-Za-z0-9]*$"
                                    }
                                  }
                                }
                              }
                            }
                          }
                        ]
                      }
                    }
                  },
                  {
                    "type": "object",
                    "additionalProperties": false,
                    "required": [
                      "asText"
                    ],
                    "properties": {
                      "asText": {
                        "type": "string",
                        "minLength": 1
                      }
                    }
                  },
                  {
                    "type": "object",
                    "additionalProperties": false,
                    "required": [
                      "drop"
                    ],
                    "properties": {
                      "drop": {
                        "type": "string",
                        "minLength": 1
                      }
                    }
                  }
                ]
              }
            }
          }
        }
      }
    }
  }
}
